,name,quality,base_atk,substat,passive
163,Xiphos' Moonlight,,510(42),Elemental Mastery 165(36),"Jinni's WhisperThe following effect will trigger every 10s: The equipping character will gain 0.036~0.072% Energy Recharge for each point of Elemental Mastery they possess for 12s, with nearby party members gaining 30% of this buff for the same duration. Multiple instances of this weapon can allow this buff to stack. This effect will still trigger even if the character is not on the field."
164,Black Tassel,,354(38),HP 46.9%(10.2%),Bane of the SoftIncreases DMG against slimes by 40~80%.
165,Bloodtainted Greatsword,,354(38),Elemental Mastery 187(41),Bane of Fire and ThunderIncreases DMG against opponents affected by Pyro or Electro by 12~24%.
166,Cool Steel,,401(39),ATK 35.2%(7.7%),Bane of Water and IceIncreases DMG against opponents affected by Hydro or Cryo by 12~24%.
167,Dark Iron Sword,,401(39),Elemental Mastery 141(31),"OverloadedUpon causing an Overloaded, Superconduct, Electro-Charged, Quicken, Aggravate, Hyperbloom, or Electro-infused Swirl reaction, ATK is increased by 20~40% for 12s."
168,Debate Club,,401(39),ATK 35.2%(7.7%),"Blunt ConclusionAfter using an Elemental Skill, Normal or Charged Attacks, on hit, deal an additional 60~120% ATK DMG in a small area. Effect lasts 15s. DMG can only occur once every 3s."
169,Emerald Orb,,448(40),Elemental Mastery 94(20),"RapidsUpon causing a Vaporize, Electro-Charged, Frozen, Bloom, or a Hydro-infused Swirl reaction, increases ATK by 20~40% for 12s."
170,Ferrous Shadow,,401(39),HP 35.2%(7.7%),"UnbendingWhen HP falls below 70~90%, increases Charged Attack DMG by 30~50%, and Charged Attacks become much harder to interrupt."
171,Fillet Blade,,401(39),ATK 35.2%(7.7%),"GashOn hit, has 50% chance to deal 240~400% ATK DMG to a single enemy. Can only occur once every 15~11s."
172,Halberd,,448(40),ATK 23.4%(5.1%),HeavyNormal Attacks deal an additional 160~320% DMG. Can only occur once every 10s.
173,Harbinger of Dawn,,401(39),CRIT DMG 46.9%(10.2%),"VigorousWhen HP is above 90%, increases CRIT Rate by 14~28%."
174,Magic Guide,,354(38),Elemental Mastery 187(41),Bane of Storm and TideIncreases DMG against opponents affected by Hydro or Electro by 12~24%.
175,Messenger,,448(40),CRIT DMG 31.2%(6.8%),Archer's MessageCharged Attack hits on weak spots deal an additional 100~200% ATK DMG as CRIT DMG. Can only occur once every 10s.
176,Otherworldly Story,,401(39),Energy Recharge 39.0%(8.5%),Energy ShowerEach Elemental Orb or Particle collected restores 1~2% HP.
177,Raven Bow,,448(40),Elemental Mastery 94(20),Bane of Flame and WaterIncreases DMG against opponents affected by Hydro or Pyro by 12~24%.
178,Recurve Bow,,354(38),HP 46.9%(10.2%),Cull the WeakDefeating an opponent restores 8~16% HP.
179,Sharpshooter's Oath,,401(39),CRIT DMG 46.9%(10.2%),PreciseIncreases DMG against weak spots by 24~48%.
180,Skyrider Greatsword,,401(39),Physical DMG Bonus 43.9%(9.6%),"CourageOn hit, Normal or Charged Attacks increase ATK by 6~10% for 6s. Max 4 stacks. Can only occur once every 0.5s."
181,Skyrider Sword,,354(38),Energy Recharge 51.7%(11.3%),DeterminationUsing an Elemental Burst grants a 12~24% increase in ATK and Movement SPD for 15s.
182,Slingshot,,354(38),CRIT Rate 31.2%(6.8%),"SlingshotIf a Normal or Charged Attack hits a target within 0.3s of being fired, increases DMG by 36~60%. Otherwise, decreases DMG by 10%."
183,Thrilling Tales of Dragon Slayers,,401(39),HP 35.2%(7.7%),"HeritageWhen switching characters, the new character taking the field has their ATK increased by 24~48% for 10s. This effect can only occur once every 20s."
184,Traveler's Handy Sword,,448(40),DEF 29.3%(6.4%),JourneyEach Elemental Orb or Particle collected restores 1~2% HP.
185,Twin Nephrite,,448(40),CRIT Rate 15.6%(3.4%),Guerilla TacticsDefeating an opponent increases Movement SPD and ATK by 12~20% for 15s.
186,White Iron Greatsword,,401(39),DEF 43.9%(9.6%),Cull the WeakDefeating an opponent restores 8~16% HP.
187,White Tassel,,401(39),CRIT Rate 23.4%(5.1%),SharpIncreases Normal Attack DMG by 24~48%.
188,Iron Point,,243(33),None,None
189,Old Merc's Pal,,243(33),None,None
190,Pocket Grimoire,,243(33),None,None
191,Seasoned Hunter's Bow,,243(33),None,None
192,Silver Sword,,243(33),None,None
193,Apprentice's Notes,,185(23),None,None
194,Beginner's Protector,,185(23),None,None
195,Dull Blade,,185(23),None,None
196,Hunter's Bow,,185(23),None,None
197,Waster Greatsword,,185(23),None,None
